{
  "$schema": "https://json-schema.org/draft/2020-12/schema",
  "$id": "https://brain.arunp.in/schemas/youtube-evaluator-execution-contract-v1.1.json",
  "title": "Frozen Gate 4 local Qwen blinded-evaluator execution contract",
  "type": "object",
  "additionalProperties": false,
  "required": ["schema_version", "contract_id", "workflow", "pinned_runtime", "role_invocations", "inference_settings", "inference_accounting", "execution_boundary", "transfer_boundary", "data_posture", "consent", "claims_boundary", "visual_boundary"],
  "properties": {
    "schema_version": { "const": "1.1" },
    "contract_id": { "const": "G4-LOCAL-QWEN-BLINDED-EVALUATION-1.0" },
    "workflow": {
      "type": "object", "additionalProperties": false,
      "required": ["platform", "role_kind", "evaluator_roles", "adjudicator_role", "fresh_process_per_role", "separate_locked_prompt_per_role", "separate_seed_per_role", "separate_blinding_per_role", "candidate_identity_hidden_from_roles", "candidate_runtime_hidden_from_roles", "candidate_price_latency_hidden_from_roles", "other_evaluator_result_hidden_until_adjudication", "same_model_family_as_candidate", "same_model_evaluator_bias", "independent_human_evaluation_claim"],
      "properties": {
        "platform": { "const": "local_llama_cpp" },
        "role_kind": { "const": "pinned_local_ai_model" },
        "evaluator_roles": { "const": ["evaluator_a", "evaluator_b"] },
        "adjudicator_role": { "const": "adjudicator" },
        "fresh_process_per_role": { "const": true },
        "separate_locked_prompt_per_role": { "const": true },
        "separate_seed_per_role": { "const": true },
        "separate_blinding_per_role": { "const": true },
        "candidate_identity_hidden_from_roles": { "const": true },
        "candidate_runtime_hidden_from_roles": { "const": true },
        "candidate_price_latency_hidden_from_roles": { "const": true },
        "other_evaluator_result_hidden_until_adjudication": { "const": true },
        "same_model_family_as_candidate": { "const": true },
        "same_model_evaluator_bias": { "const": "disclosed_material_reproducibility_limitation" },
        "independent_human_evaluation_claim": { "const": "not_asserted" }
      }
    },
    "pinned_runtime": {
      "type": "object", "additionalProperties": false,
      "required": ["runtime_ledger_path", "candidate_id", "runtime_project", "runtime_release_tag", "runtime_commit", "llama_cli_sha256", "model_repository", "model_revision", "model_filename", "model_sha256", "sandbox_profile_path", "sandbox_profile_sha256"],
      "properties": {
        "runtime_ledger_path": { "const": "docs/feature-council/youtube-transcript-enrichment/benchmark/model/LOCAL_MODEL_RUNTIME_LEDGER.json" },
        "candidate_id": { "const": "LOCAL-QWEN3-8B-Q4_K_M-LLAMA_CPP-B9637" },
        "runtime_project": { "const": "ggml-org/llama.cpp" },
        "runtime_release_tag": { "const": "b9637" },
        "runtime_commit": { "const": "aedb2a5e9ca3d4064148bbb919e0ddc0c1b70ab3" },
        "llama_cli_sha256": { "const": "b8c1891d697f72c1e9c05d0613b4f3d091e388acc2c4e1afa535c19df5d50fc3" },
        "model_repository": { "const": "Qwen/Qwen3-8B-GGUF" },
        "model_revision": { "const": "6a569868d07d3bd59e8b97fb001bf8c0b254bb20" },
        "model_filename": { "const": "Qwen3-8B-Q4_K_M.gguf" },
        "model_sha256": { "const": "d98cdcbd03e17ce47681435b5150e34c1417f50b5c0019dd560e4882c5745785" },
        "sandbox_profile_path": { "const": "docs/feature-council/youtube-transcript-enrichment/spikes/model-harness/deny-network.sb" },
        "sandbox_profile_sha256": { "const": "28fbf7e712236b6f3baa33f1d85f3312f5ef0d8096b3e5b6c2229d08120811c0" }
      }
    },
    "role_invocations": {
      "const": [
        { "role": "evaluator_a", "seed": 424243, "system_prompt_path": "docs/feature-council/youtube-transcript-enrichment/benchmark/model/EVALUATOR_A_SYSTEM_PROMPT.txt", "system_prompt_sha256": "db09d88dee6a6d26546e300b1bd044261db0279cefb4f4cbbf37916378f74fad", "output_generation_schema_path": "docs/feature-council/youtube-transcript-enrichment/benchmark/model/BLINDED_EVALUATION_GENERATION.schema.json", "output_generation_schema_sha256": "6a81f8df59a2795ac7b4450a247996e5c322b35fdd97c90cbe57c8e1f10da0f3", "strict_postparse_schema_path": "docs/feature-council/youtube-transcript-enrichment/benchmark/model/BLINDED_EVALUATION.schema.json", "strict_postparse_schema_sha256": "114d266956a663d4ac849591c4bae6e0baaa465596e28f765712e3192407a0e2" },
        { "role": "evaluator_b", "seed": 424244, "system_prompt_path": "docs/feature-council/youtube-transcript-enrichment/benchmark/model/EVALUATOR_B_SYSTEM_PROMPT.txt", "system_prompt_sha256": "c30d7e6ec3e1bbdf305afb714ee5818ce904c2ab17ef3731b6eae5160259710b", "output_generation_schema_path": "docs/feature-council/youtube-transcript-enrichment/benchmark/model/BLINDED_EVALUATION_GENERATION.schema.json", "output_generation_schema_sha256": "6a81f8df59a2795ac7b4450a247996e5c322b35fdd97c90cbe57c8e1f10da0f3", "strict_postparse_schema_path": "docs/feature-council/youtube-transcript-enrichment/benchmark/model/BLINDED_EVALUATION.schema.json", "strict_postparse_schema_sha256": "114d266956a663d4ac849591c4bae6e0baaa465596e28f765712e3192407a0e2" },
        { "role": "adjudicator", "seed": 424245, "system_prompt_path": "docs/feature-council/youtube-transcript-enrichment/benchmark/model/ADJUDICATOR_SYSTEM_PROMPT.txt", "system_prompt_sha256": "1118a1683b3f8b2c5d253f2aa0b8e0db02df6601136f2fbbf106fea8998a5ad9", "output_generation_schema_path": "docs/feature-council/youtube-transcript-enrichment/benchmark/model/BLINDED_ADJUDICATION_GENERATION.schema.json", "output_generation_schema_sha256": "f0eaa99b6f689a48242b52465334a87f17a7f582d12cabbc7fcfb77ccc800396", "strict_postparse_schema_path": "docs/feature-council/youtube-transcript-enrichment/benchmark/model/BLINDED_ADJUDICATION.schema.json", "strict_postparse_schema_sha256": "470e1e606da562b6bae9771038d77b20758aa3bb3e6ee99324d628179f2f78e4" }
      ]
    },
    "inference_settings": {
      "type": "object", "additionalProperties": false,
      "required": ["interface", "offline", "server_mode", "remote_model_resolution", "temperature", "top_k", "top_p", "min_p", "repeat_penalty", "context_size", "max_output_tokens", "threads", "threads_batch", "gpu_layers", "reasoning", "attempt_limit_per_role", "semantic_or_format_retry", "timeout_ms_per_role"],
      "properties": {
        "interface": { "const": "llama-cli_files_only" }, "offline": { "const": true }, "server_mode": { "const": "prohibited" }, "remote_model_resolution": { "const": "prohibited" },
        "temperature": { "const": 0 }, "top_k": { "const": 1 }, "top_p": { "const": 1 }, "min_p": { "const": 0 }, "repeat_penalty": { "const": 1 },
        "context_size": { "const": 16384 }, "max_output_tokens": { "const": 4096 }, "threads": { "const": 8 }, "threads_batch": { "const": 8 }, "gpu_layers": { "const": "all" }, "reasoning": { "const": "disabled" },
        "attempt_limit_per_role": { "const": 1 }, "semantic_or_format_retry": { "const": "prohibited" }, "timeout_ms_per_role": { "const": 1800000 }
      }
    },
    "inference_accounting": {
      "type": "object", "additionalProperties": false,
      "required": ["candidate_initial_invocations", "candidate_format_only_retries_maximum", "candidate_invocations_maximum", "blinded_evaluator_invocations", "adjudicator_invocations_maximum", "total_local_inference_invocations_maximum", "model_roster_count", "external_provider_calls"],
      "properties": {
        "candidate_initial_invocations": { "const": 5 },
        "candidate_format_only_retries_maximum": { "const": 5 },
        "candidate_invocations_maximum": { "const": 10 },
        "blinded_evaluator_invocations": { "const": 2 },
        "adjudicator_invocations_maximum": { "const": 1 },
        "total_local_inference_invocations_maximum": { "const": 13 },
        "model_roster_count": { "const": 1 },
        "external_provider_calls": { "const": 0 }
      }
    },
    "execution_boundary": {
      "type": "object", "additionalProperties": false,
      "required": ["local_private_machine_only", "packet_only_file_binding", "deny_network_sandbox_required", "tools_available_to_model", "network_available_to_model", "evaluator_initiated_provider_calls", "external_api_calls", "external_content_transfer", "complete_transcript_in_packet", "private_paths_in_packet", "credentials_in_packet", "incremental_spend_usd", "fail_closed_if_runtime_model_prompt_sandbox_consent_or_posture_unavailable"],
      "properties": {
        "local_private_machine_only": { "const": true }, "packet_only_file_binding": { "const": true }, "deny_network_sandbox_required": { "const": true },
        "tools_available_to_model": { "const": false }, "network_available_to_model": { "const": false }, "evaluator_initiated_provider_calls": { "const": 0 }, "external_api_calls": { "const": 0 }, "external_content_transfer": { "const": false },
        "complete_transcript_in_packet": { "const": false }, "private_paths_in_packet": { "const": false }, "credentials_in_packet": { "const": false }, "incremental_spend_usd": { "const": 0 },
        "fail_closed_if_runtime_model_prompt_sandbox_consent_or_posture_unavailable": { "const": true }
      }
    },
    "transfer_boundary": {
      "type": "object", "additionalProperties": false,
      "required": ["content", "maximum_excerpts_per_item", "maximum_words_per_excerpt", "maximum_total_excerpt_words_per_item", "maximum_unique_transcript_word_position_fraction", "complete_or_reconstructable_transcript_prohibited", "additional_content_for_adjudication_prohibited"],
      "properties": {
        "content": { "const": "generated_enrichment_public_rubric_and_bounded_cited_excerpts_only" }, "maximum_excerpts_per_item": { "const": 12 }, "maximum_words_per_excerpt": { "const": 40 },
        "maximum_total_excerpt_words_per_item": { "const": 240 }, "maximum_unique_transcript_word_position_fraction": { "const": 0.35 }, "complete_or_reconstructable_transcript_prohibited": { "const": true }, "additional_content_for_adjudication_prohibited": { "const": true }
      }
    },
    "data_posture": {
      "type": "object", "additionalProperties": false,
      "required": ["external_provider", "external_retention", "external_training", "zero_data_retention", "local_training", "private_packet_and_result_retention", "publication", "incremental_subscription_or_usage_purchase"],
      "properties": {
        "external_provider": { "const": "none" }, "external_retention": { "const": "not_applicable_no_external_transfer" }, "external_training": { "const": "not_applicable_no_external_transfer" },
        "zero_data_retention": { "const": "not_claimed_not_applicable_local_execution" }, "local_training": { "const": "prohibited_and_not_performed" },
        "private_packet_and_result_retention": { "const": "delete_with_private_benchmark_packet_by_2026-10-14" }, "publication": { "const": "hashes_counts_rates_and_provisional_decisions_only" },
        "incremental_subscription_or_usage_purchase": { "const": "prohibited" }
      }
    },
    "consent": {
      "type": "object", "additionalProperties": false,
      "required": ["basis", "execution_time_private_consent_attestation_required", "consent_attestation_must_predate_packet_generation", "fail_closed_if_absent_or_withdrawn"],
      "properties": {
        "basis": { "const": "affirmative_user_authorization_of_local_multi_agent_evaluation_workflow" }, "execution_time_private_consent_attestation_required": { "const": true }, "consent_attestation_must_predate_packet_generation": { "const": true }, "fail_closed_if_absent_or_withdrawn": { "const": true }
      }
    },
    "claims_boundary": { "const": "ai_evaluated_provisional_pending_human_stakeholder_review" },
    "visual_boundary": {
      "type": "object", "additionalProperties": false,
      "required": ["visual_method_sealed", "rights_authorized_visual_media_set_present", "visual_processing_authorized", "triggered_state"],
      "properties": { "visual_method_sealed": { "const": false }, "rights_authorized_visual_media_set_present": { "const": false }, "visual_processing_authorized": { "const": false }, "triggered_state": { "const": "triggered_but_blocked" } }
    }
  }
}
